{
  "schemaVersion": "1.0.0",
  "repository": "AIAllTheThingz/Engineering-Standards",
  "workflow": "Governance CI",
  "workflowFile": ".github/workflows/governance-ci.yml",
  "runId": 30288447671,
  "runAttempt": 1,
  "validatedCommitSha": "d847c995a52735954f8c23c1d78a7f841af13b32",
  "branch": "agent/refresh-pr90-closeout-evidence",
  "trigger": "pull_request",
  "conclusion": "success",
  "checkName": "Governance / Governance validation",
  "artifactName": "governance-evidence-30288447671",
  "artifactId": 8662176756,
  "artifactSha256": "c130d4df775df262c523b963a36c64a09c817c8cbcc37bfcac076ff10d3cdee1",
  "verifiedAtUtc": "2026-07-27T17:30:58Z",
  "verifiedBy": "GPT-5.6 Thinking via the GitHub connector and independent ZIP hash and JSON verification",
  "controlledFailureRunId": 28306149811,
  "controlledFailureConclusion": "failure",
  "notes": [
    "Governance CI run 30288447671 completed successfully for PR #92 implementation head d847c995a52735954f8c23c1d78a7f841af13b32 on branch agent/refresh-pr90-closeout-evidence. GitHub artifact metadata bound the run and artifact to that exact head SHA and branch.",
    "The workflow completion evidence used synthetic pull-request merge context 2ff72546e0b2ba4ec588755ba2a4e4acca939595 on ref 92/merge. That synthetic merge identity is recorded separately here and must not be substituted for the GitHub API head SHA or head branch.",
    "Artifact governance-evidence-30288447671, ID 8662176756, contained 14 JSON files. Its GitHub digest and independently computed ZIP SHA-256 both matched c130d4df775df262c523b963a36c64a09c817c8cbcc37bfcac076ff10d3cdee1. Every JSON file parsed successfully.",
    "All 17 governance categories passed. Pester discovered and passed 1027 of 1027 tests with zero failures, skips, or not-run tests. Trusted Governance validation, candidate implementation validation, evidence generation, evidence validation, artifact upload, and mandatory-result enforcement all completed successfully.",
    "The governance artifact recorded no Failed result. Its only Blocked result was the intentionally suspended enterprise-powershell behavior gate, and nine NotRun records truthfully declared model behavior that was not executed.",
    "Python example CI run 30288446989, Bash example CI run 30288446998, and Pull Request Governance run 30288448297 also completed successfully for implementation head d847c995a52735954f8c23c1d78a7f841af13b32. Their final-cycle artifact ZIPs were not independently downloaded or rehashed and that inspection remains NotRun.",
    "Controlled-failure run 28306149811 remains the independently verified historical proof that mandatory enforcement fails after evidence upload when a required result is deliberately failed. It was not rerun during PR #92 and is retained without implying otherwise.",
    "The published v1.1.0 annotated tag remains unsigned and resolves to immutable release target 2704049d7e826975d956611b194214dd79ea3686. This record verifies unreleased PR #92 implementation head d847c995a52735954f8c23c1d78a7f841af13b32; it does not rewrite the historical contents of v1.1.0 or certify a later metadata-only commit."
  ]
}
