{
  "schemaVersion": "1.0.0",
  "repository": "AIAllTheThingz/Engineering-Standards",
  "workflow": "Governance CI",
  "workflowFile": ".github/workflows/governance-ci.yml",
  "runId": 30232343849,
  "runAttempt": 1,
  "validatedCommitSha": "d75a37a60f2c82a8ea7cefafd714ce0309ea237e",
  "branch": "_feature",
  "trigger": "pull_request",
  "conclusion": "success",
  "checkName": "Governance / Governance validation",
  "artifactName": "governance-evidence-30232343849",
  "artifactId": 8640640280,
  "artifactSha256": "f41437b4c8457225fc111f8c9d78b2d8a53463241630afc4c6145d9eb84c0914",
  "verifiedAtUtc": "2026-07-27T13:40:13Z",
  "verifiedBy": "Synthetic focused fixture",
  "controlledFailureRunId": 28306149811,
  "controlledFailureConclusion": "failure",
  "notes": [
    "Focused valid leading-underscore branch fixture."
  ]
}
